{
  "$schema": "./qgis-tools.catalog.schema.json",
  "catalog_version": "1.6.0",
  "profile_id": "qcopilots-qgis4-qt6-windows",
  "observed_at": "2026-08-24T18:00:00-07:00",
  "runtime_profile": {
    "os_family": "windows",
    "qt_major": 6,
    "qgis_version_range": ">=4.2,<5",
    "runtime_reprobe_required": true,
    "observed_versions": {
      "qgis": "4.2.0-Belém do Pará",
      "qgis_revision": "7e2adb5c81c",
      "qt": "6.11.1",
      "python": "3.12.13",
      "gdal": "3.13.1",
      "proj": "9.8.1",
      "geos": "3.14.1",
      "grass": "8.5.0",
      "pdal": "2.10.0",
      "processing_algorithm_count_total": 761,
      "processing_algorithm_count_nondeprecated": 738,
      "processing_algorithm_count_deprecated": 23,
      "processing_algorithm_count_surface": "packaged qgis-process CLI catalog snapshot",
      "processing_mcp_live_registry_count_total": 772,
      "processing_mcp_live_registry_observed_at": "2026-08-24",
      "saga": "not-installed"
    }
  },
  "path_policy": {
    "catalog_base": "creator_skill_root",
    "qgis_root_discovery": {
      "strategy": "walk_up_markers",
      "start": "creator_skill_root",
      "max_ancestor_levels": 12,
      "required_markers": [
        "bin/qgis-qt6-env.bat",
        "bin/qgis_process-qgis-qt6.bat",
        "apps/qgis-qt6/bin/qgis_process.exe",
        "apps/qgis-qt6/python/plugins/qcopilots_mcp_server_skills/qcopilots_service.json",
        "share/proj/proj.db"
      ]
    },
    "reject_absolute_catalog_paths": true,
    "reject_parent_segments": true,
    "canonicalize_before_use": true,
    "containment_check_required": true
  },
  "mcp_services": [
    {
      "service_id": "qcopilots.mcp_server_qgis_binary",
      "availability_source": "manager-config-and-runtime-tool-list",
      "manager_config_path": "apps/qgis-qt6/python/plugins/qcopilots_mcp_servers_manager/qcopilots_manager_config.json",
      "enabled_by_default_observed": true,
      "dynamic_tools": false,
      "tools": [
        {
          "name": "list_qgis_binaries",
          "description": "按分页游标和筛选条件列出 QGIS Binary 配置目录。目录只返回显式配置项，不把发布包中的 591 个程序展开成独立 MCP 工具。",
          "status": "allowed",
          "risk_level": "R0",
          "requires_qgis_bridge": true,
          "requires_gui": true,
          "requires_explicit_confirmation": false,
          "side_effects": {"reads_files": true, "writes_files": false, "modifies_qgis_state": false, "uses_network": false, "runs_shell": false, "destructive_possible": false}
        },
        {
          "name": "get_qgis_binary_details",
          "description": "按稳定 binary_id 读取相对路径、启用状态、风险、环境、探测和运行限制。",
          "status": "allowed",
          "risk_level": "R0",
          "requires_qgis_bridge": true,
          "requires_gui": true,
          "requires_explicit_confirmation": false,
          "side_effects": {"reads_files": true, "writes_files": false, "modifies_qgis_state": false, "uses_network": false, "runs_shell": false, "destructive_possible": false}
        },
        {
          "name": "start_qgis_binary",
          "description": "按已启用 binary_id 和原样 argv 启动异步 QgsTask 作业。R2 配置项每次调用都必须传 confirmed_risk=true，R3 配置项不能启动。",
          "status": "restricted",
          "risk_level": "R2",
          "requires_qgis_bridge": true,
          "requires_gui": true,
          "requires_explicit_confirmation": true,
          "invocation_policy": {"require_all_schema_properties_explicit": false, "required_arguments": ["binary_id"], "required_any_argument_groups": [], "required_target_arguments": ["binary_id"], "command_shape": "argv-only", "notes": "选择 R2 配置项时必须显式提供 confirmed_risk=true。工具不接受任意 executable path 或环境变量覆盖。"},
          "side_effects": {"reads_files": true, "writes_files": true, "modifies_qgis_state": false, "uses_network": true, "runs_shell": false, "destructive_possible": true}
        },
        {
          "name": "get_qgis_binary_job",
          "description": "按 job_id 读取 QGIS Binary 作业完整快照，包括进度、状态、受限输出和结构化错误。",
          "status": "allowed",
          "risk_level": "R0",
          "requires_qgis_bridge": true,
          "requires_gui": true,
          "requires_explicit_confirmation": false,
          "side_effects": {"reads_files": false, "writes_files": false, "modifies_qgis_state": false, "uses_network": false, "runs_shell": false, "destructive_possible": false}
        },
        {
          "name": "list_qgis_binary_jobs",
          "description": "按公开状态和数量限制列出当前 QGIS 进程保留的 QGIS Binary 作业摘要。",
          "status": "allowed",
          "risk_level": "R0",
          "requires_qgis_bridge": true,
          "requires_gui": true,
          "requires_explicit_confirmation": false,
          "side_effects": {"reads_files": false, "writes_files": false, "modifies_qgis_state": false, "uses_network": false, "runs_shell": false, "destructive_possible": false}
        },
        {
          "name": "cancel_qgis_binary_job",
          "description": "请求取消指定 QGIS Binary 作业并终止其进程树。取消竞态仍可能以成功、失败或已取消终态结束。",
          "status": "restricted",
          "risk_level": "R2",
          "requires_qgis_bridge": true,
          "requires_gui": true,
          "requires_explicit_confirmation": true,
          "invocation_policy": {"require_all_schema_properties_explicit": true, "required_arguments": ["job_id"], "required_any_argument_groups": [], "required_target_arguments": ["job_id"], "command_shape": "schema-defined"},
          "side_effects": {"reads_files": false, "writes_files": false, "modifies_qgis_state": true, "uses_network": false, "runs_shell": false, "destructive_possible": true}
        }
      ]
    },
    {
      "service_id": "qcopilots.mcp_server_builtin_tools",
      "availability_source": "manager-config-and-runtime-tool-list",
      "manager_config_path": "apps/qgis-qt6/python/plugins/qcopilots_mcp_servers_manager/qcopilots_manager_config.json",
      "enabled_by_default_observed": true,
      "dynamic_tools": false,
      "tools": [
        {
          "name": "read_file",
          "description": "读取 UTF-8 文本文件。相对路径从服务基目录解析，普通本机绝对路径在操作系统 ACL 允许时可访问，UNC、设备路径、ADS 和危险重解析点会被拒绝。",
          "status": "allowed",
          "risk_level": "R0",
          "requires_qgis_bridge": false,
          "requires_gui": false,
          "requires_explicit_confirmation": false,
          "invocation_policy": {"require_all_schema_properties_explicit": true, "required_arguments": ["path"], "required_any_argument_groups": [], "required_target_arguments": ["path"], "command_shape": "schema-defined"},
          "side_effects": {"reads_files": true, "writes_files": false, "modifies_qgis_state": false, "uses_network": false, "runs_shell": false, "destructive_possible": false}
        },
        {
          "name": "get_file_metadata",
          "description": "读取常规文件的字节数、扩展名、文件签名字节和完整 SHA-256。相对路径从服务基目录解析，普通本机绝对路径在操作系统 ACL 允许时可访问。",
          "status": "allowed",
          "risk_level": "R0",
          "requires_qgis_bridge": false,
          "requires_gui": false,
          "requires_explicit_confirmation": false,
          "invocation_policy": {"require_all_schema_properties_explicit": true, "required_arguments": ["path"], "required_any_argument_groups": [], "required_target_arguments": ["path"], "command_shape": "schema-defined"},
          "side_effects": {"reads_files": true, "writes_files": false, "modifies_qgis_state": false, "uses_network": false, "runs_shell": false, "destructive_possible": false}
        },
        {
          "name": "copy_file",
          "description": "在操作系统 ACL 允许的普通本机路径间复制常规文件。必须使用 expected_source_sha256 绑定源版本，并拒绝覆盖已存在的目标。",
          "status": "restricted",
          "risk_level": "R2",
          "requires_qgis_bridge": false,
          "requires_gui": false,
          "requires_explicit_confirmation": true,
          "invocation_policy": {"require_all_schema_properties_explicit": true, "required_arguments": ["source", "target", "expected_source_sha256"], "required_any_argument_groups": [], "required_target_arguments": ["source", "target"], "command_shape": "schema-defined"},
          "side_effects": {"reads_files": true, "writes_files": true, "modifies_qgis_state": false, "uses_network": false, "runs_shell": false, "destructive_possible": false},
          "notes": "目标已存在时拒绝复制，源版本必须匹配完整 SHA-256。UNC、设备路径、ADS 和危险重解析点仍会被拒绝。"
        },
        {
          "name": "file_glob_search",
          "description": "在普通本机目录中发现文件。相对路径从服务基目录解析，绝对搜索根在操作系统 ACL 允许时可访问。",
          "status": "allowed",
          "risk_level": "R0",
          "requires_qgis_bridge": false,
          "requires_gui": false,
          "requires_explicit_confirmation": false,
          "invocation_policy": {"require_all_schema_properties_explicit": true, "required_arguments": [], "required_any_argument_groups": [["path", "root"]], "required_any_target_argument_groups": [["path", "root"]], "required_target_arguments": [], "command_shape": "schema-defined"},
          "side_effects": {"reads_files": true, "writes_files": false, "modifies_qgis_state": false, "uses_network": false, "runs_shell": false, "destructive_possible": false}
        },
        {
          "name": "grep_search",
          "description": "在文本文件中检索内容。必须限制搜索根、文件数量、结果数和时间，不能扫描用户未授权目录。",
          "status": "allowed",
          "risk_level": "R0",
          "requires_qgis_bridge": false,
          "requires_gui": false,
          "requires_explicit_confirmation": false,
          "invocation_policy": {"require_all_schema_properties_explicit": true, "required_arguments": ["pattern"], "required_any_argument_groups": [["path", "root"]], "required_any_target_argument_groups": [["path", "root"]], "required_target_arguments": [], "command_shape": "schema-defined"},
          "side_effects": {"reads_files": true, "writes_files": false, "modifies_qgis_state": false, "uses_network": false, "runs_shell": false, "destructive_possible": false}
        },
        {
          "name": "write_file",